{
  "schema_version": "pollek.lcp.usage-ledger.v1",
  "ledger_id": "fixture_windows_usage_ledger_20260630",
  "tenant_id": "local",
  "lcp_id": "lcp_local",
  "device_id": "device_local_windows",
  "os_family": "windows",
  "os_version": "Windows 11 Pro 24H2",
  "capture_method": "windows_etw_wmi",
  "observed_at": "2026-06-30T01:10:00.000Z",
  "usage_entries": [
    {
      "id": "fixture_windows_antigravity_gemini",
      "entity_id": "entity_agent_antigravity",
      "agent_id": "entity_agent_antigravity",
      "agent_name": "Antigravity",
      "application_name": "Antigravity",
      "device_id": "device_local_windows",
      "device_name": "DELL-WINDOWS",
      "os_family": "windows",
      "user_subject": "DELL\\LocalAdmin",
      "provider": "Google",
      "model": "gemini-2.5-pro",
      "pricing_model": "credit_pool",
      "billing_pool_id": "credit_pool_local_gemini_agents",
      "allocation_method": "lcp_reported_agent_share",
      "call_count": 9,
      "input_tokens": 28500,
      "output_tokens": 9200,
      "total_tokens": 37700,
      "billed_credits": 3.77,
      "allocated_cost_cents": 377,
      "currency": "USD",
      "confidence": "reported_by_lcp",
      "observed_at": "2026-06-30T01:10:00.000Z"
    },
    {
      "id": "fixture_windows_openclaw_gemini",
      "entity_id": "agent_openclaw_gateway",
      "agent_id": "agent_openclaw_gateway",
      "agent_name": "OpenClaw Gateway",
      "application_name": "OpenClaw",
      "device_id": "device_local_windows",
      "device_name": "DELL-WINDOWS",
      "os_family": "windows",
      "user_subject": "DELL\\LocalAdmin",
      "provider": "Google",
      "model": "gemini-2.5-pro",
      "pricing_model": "credit_pool",
      "billing_pool_id": "credit_pool_local_gemini_agents",
      "allocation_method": "lcp_reported_agent_share",
      "call_count": 4,
      "input_tokens": 12200,
      "output_tokens": 4100,
      "total_tokens": 16300,
      "billed_credits": 1.63,
      "allocated_cost_cents": 163,
      "currency": "USD",
      "confidence": "reported_by_lcp",
      "observed_at": "2026-06-30T01:10:00.000Z"
    }
  ],
  "signature": {
    "alg": "fixture-none",
    "kid": "local-dev-fixture",
    "value": "unsigned-fixture"
  }
}
