{
  "schema_version": "pollek.lcp.usage-ledger.v1",
  "ledger_id": "fixture_linux_usage_ledger_20260630",
  "tenant_id": "local",
  "lcp_id": "lcp_dc_gpu_01",
  "device_id": "device_dc_gpu_01",
  "os_family": "linux",
  "os_version": "Ubuntu Server 24.04 LTS",
  "capture_method": "linux_ebpf_auditd",
  "observed_at": "2026-06-30T01:20:00.000Z",
  "usage_entries": [
    {
      "id": "fixture_linux_codex_gpt5",
      "agent_id": "agent_codex_gpu",
      "agent_name": "OpenAI Codex (CLI)",
      "application_name": "Codex CLI",
      "device_id": "device_dc_gpu_01",
      "device_name": "DC-GPU-01",
      "os_family": "linux",
      "user_subject": "research\\ml-admin",
      "provider": "OpenAI",
      "model": "gpt-5-codex",
      "pricing_model": "token_metered",
      "allocation_method": "direct_token_meter",
      "call_count": 31,
      "input_tokens": 102000,
      "output_tokens": 38500,
      "total_tokens": 140500,
      "allocated_cost_cents": 1216,
      "currency": "USD",
      "confidence": "reported_by_lcp",
      "observed_at": "2026-06-30T01:20:00.000Z"
    },
    {
      "id": "fixture_linux_local_llm_credit",
      "agent_id": "agent_sgx_shadow",
      "agent_name": "Local Research Agent",
      "application_name": "Research Batch Agent",
      "device_id": "device_dc_gpu_01",
      "device_name": "DC-GPU-01",
      "os_family": "linux",
      "user_subject": "research\\contractor",
      "provider": "Private Model Gateway",
      "model": "llama-3.1-70b-private",
      "pricing_model": "credit_pool",
      "billing_pool_id": "credit_pool_local_research_lab",
      "allocation_method": "lcp_reported_gpu_credit_share",
      "call_count": 18,
      "input_tokens": 74200,
      "output_tokens": 21600,
      "total_tokens": 95800,
      "billed_credits": 9.58,
      "allocated_cost_cents": 958,
      "currency": "USD",
      "confidence": "reported_by_lcp",
      "observed_at": "2026-06-30T01:20:00.000Z"
    }
  ],
  "signature": {
    "alg": "fixture-none",
    "kid": "local-dev-fixture",
    "value": "unsigned-fixture"
  }
}
